Claim Type,Insurer Name,Count,Claimed,Approved,Rejected_Count,Loss,Rejection_Rate
institutional,Gulf Union Cooperative Insurance Company,151,1481756.14,456808.24,90,1024947.8999999999,59.6
institutional,Arabia Insurance Cooperative Company,109,1292690.2,323005.14,43,969685.0599999999,39.45
institutional,AL Jazira Takaful,28,737848.59,103278.95,21,634569.64,75.0
institutional,Al-Rajhi Company for Cooperative Insurance,84,836332.63,291704.13,27,544628.5,32.14
institutional,Amana Cooperative Insurance Company *,77,703693.92,266822.55,30,436871.37000000005,38.96
professional,AL Jazira Takaful,100,129508.39,15714.46,52,113793.93,52.0
institutional,Salama Cooperative Insurance Company,24,186826.51,87529.04,8,99297.47000000002,33.33
